{
  "$schema": "data-structures/schema/vm-block.schema.json",
  "schemaVersion": 1,
  "kind": "vm-block",
  "id": 8,
  "name": "VM_BLK_EDGE",
  "title": "Edge",
  "category": "logic",
  "description": "Pulses ENO for one pass when the combined EN level rises, falls or changes in either direction.",
  "source_file": "components/VM/blocks/edge/vm_block_edge.h",
  "activation": {
    "kind": "enabled",
    "description": "Samples EN every pass, including when EN is false."
  },
  "inputs": {
    "min": 0,
    "max": 0,
    "pins": []
  },
  "outputs": {
    "min": 0,
    "max": 0,
    "pins": []
  },
  "rules": [
    {
      "rule": "At least one EN source is connected; no data inputs or outputs.",
      "error": "ERR_VM_BLK_BAD_SHAPE",
      "error_tag": 43296
    },
    {
      "rule": "edge_type is a vm_edge_type_e value.",
      "error": "ERR_VM_BLK_BAD_SHAPE",
      "error_tag": 43296
    }
  ],
  "eno": {
    "title": "Pulse",
    "description": "One-pass pulse when the selected EN edge occurs."
  },
  "header": {
    "lead": [
      {
        "ref": "edge_type",
        "kind": "field",
        "field": "edge_type"
      },
      {
        "text": " edge"
      }
    ]
  },
  "state": {
    "struct": "vm_block_edge_data_t",
    "source_file": "components/VM/blocks/edge/vm_block_edge.h",
    "size": 4,
    "align": 4,
    "fields": [
      {
        "name": "edge_type",
        "c_type": "uint8_t",
        "offset": 0,
        "size": 1,
        "description": "vm_edge_type_e",
        "enum_ref": "vm_edge_type_e",
        "source": "user"
      },
      {
        "name": "flags",
        "c_type": "uint8_t",
        "offset": 1,
        "size": 1,
        "description": "VM_EDGE_F_INITIALIZED",
        "source": "runtime"
      },
      {
        "name": "previous",
        "c_type": "uint8_t",
        "offset": 2,
        "size": 1,
        "description": "Previous EN level",
        "source": "runtime"
      },
      {
        "name": "_pad",
        "c_type": "uint8_t",
        "offset": 3,
        "size": 1,
        "source": "padding"
      }
    ]
  },
  "min_custom_len": 4,
  "enums": {
    "vm_edge_type_e": {
      "alias": "Edge Type",
      "source_file": "components/VM/blocks/edge/vm_block_edge.h",
      "members": [
        {
          "name": "VM_EDGE_RISING",
          "value": 0,
          "alias": null,
          "description": null
        },
        {
          "name": "VM_EDGE_FALLING",
          "value": 1,
          "alias": null,
          "description": null
        },
        {
          "name": "VM_EDGE_BOTH",
          "value": 2,
          "alias": null,
          "description": null
        },
        {
          "name": "VM_EDGE_TYPE_CNT",
          "value": 3,
          "alias": null,
          "description": null
        }
      ]
    }
  }
}
