{
  "$schema": "data-structures/schema/vm-block.schema.json",
  "schemaVersion": 1,
  "kind": "vm-block",
  "id": 3,
  "name": "VM_BLK_IF",
  "title": "If",
  "category": "flow",
  "description": "Two-way router: output 0 when the condition is non-zero, else output 1. Outputs are flow (enable sources below), cleared when the block doesn't decide.",
  "source_file": "components/VM/blocks/if/vm_block_if.h",
  "activation": {
    "kind": "enabled",
    "description": "Runs every pass while enabled."
  },
  "inputs": {
    "min": 1,
    "max": 1,
    "pins": [
      {
        "index": 0,
        "name": "condition",
        "title": "Condition",
        "value": "bool",
        "required": true
      }
    ]
  },
  "outputs": {
    "min": 2,
    "max": 2,
    "pins": [
      {
        "index": 0,
        "name": "yes",
        "title": "Yes",
        "value": "gate"
      },
      {
        "index": 1,
        "name": "no",
        "title": "No",
        "value": "gate"
      }
    ]
  },
  "rules": [],
  "min_custom_len": 0,
  "enums": {}
}
